{
  "$schema": "https://raw.githubusercontent.com/kunalsuri/1000x-Agent-Skills/main/docs/schemas/attestation.schema.json",
  "skill_name": "readme-designer",
  "version": "2.0.0",
  "attestation_status": "DRAFT",
  "capabilities": {
    "network": "none",
    "process_execution": "none",
    "dynamic_code_execution": "none",
    "filesystem": "workspace-write"
  },
  "capabilities_rationale": "audit_readme.py is read-only; scaffold_readme.py writes a README into the target repository. Link checking is filesystem-only -- no URL is ever fetched.",
  "attested_by": "Kunal Suri",
  "attestation_date": "2026-08-31",
  "tested_platforms": [
    {
      "platform": "Claude Code",
      "model": "claude-3-7-sonnet",
      "status": "NOT_RUN",
      "notes": "Version 1.0.0 was evaluated on this platform and passed; that run exercised the ornament-scoring rubric (vertical <br/> injection, hero and badge generation) which version 2.0.0 removed. The old result is not evidence about the current skill, so it is recorded as NOT_RUN rather than carried forward as a PASS.",
      "currency_caveat": "Not re-run since the 2.0.0 rewrite of the rubric, the scaffolder and SKILL.md. Status returns to TESTED only when a run against the current version is recorded."
    },
    {
      "platform": "Google Antigravity",
      "model": "gemini-3.7-flash",
      "status": "NOT_RUN",
      "notes": "Version 1.0.0 was evaluated on this platform and passed; that run exercised the ornament-scoring rubric (vertical <br/> injection, hero and badge generation) which version 2.0.0 removed. The old result is not evidence about the current skill, so it is recorded as NOT_RUN rather than carried forward as a PASS.",
      "currency_caveat": "Not re-run since the 2.0.0 rewrite of the rubric, the scaffolder and SKILL.md. Status returns to TESTED only when a run against the current version is recorded."
    }
  ],
  "performance_summary": {
    "success_rate_percent": 100,
    "average_token_consumption": 1150,
    "recovery_resilience": "High",
    "methodology_caveat": "average_token_consumption and recovery_resilience are illustrative, not the output of a documented, repeatable measurement (no run logs, no sample size, no definition of what 'recovery' was tested against). Treat them as approximate rather than as measured facts until a real methodology is attached."
  },
  "provenance": {
    "source_type": "original",
    "origin_url": "https://github.com/kunalsuri/1000x-Agent-Skills",
    "license": "Apache-2.0"
  },
  "security_audit": {
    "tool": "scripts/audit_skill_safety.py",
    "method": "AST-based capability analysis of every script in the skill, plus a scan of every Markdown file for instruction-surface attacks (invisible and bidirectional Unicode, directive-bearing HTML comments, encoded payloads, pipe-to-shell, credential exfiltration). The capabilities the code actually has are compared against the 'capabilities' block above; the build fails if the code exceeds its declaration.",
    "last_run_date": "2026-08-30",
    "last_run_result": "PASS",
    "enforcement": "Unlike the tested_platforms rows above, this is not a point-in-time claim: it re-runs on every push and pull request, and the content digest below means the attestation stops matching if any file here is edited without re-attesting.",
    "reproduce": "python scripts/audit_skill_safety.py --skill readme-designer --strict"
  },
  "content_digest": "sha256:9b92cdc32ec10d0b7c196443180fe4028025dfca3e7aefa0429ba437f7227065"
}
